grammar_id,例句,空格題目,正解,中文翻譯
G025,長年の使用に堪える丈夫な素材が使われている。,長年の使用____丈夫な素材が使われている。,に堪える,使用了經得起長年使用的耐用材料。
G025,彼の作品は専門家の評価に堪える完成度だ。,彼の作品は専門家の評価____完成度だ。,に堪える,他的作品完成度足以經得起專家評價。
G025,その報告書は公開に堪える内容ではなかった。,その報告書は公開____内容ではなかった。,に堪える,那份報告書內容不足以公開。
G025,この映画は何度も見るに堪える魅力がある。,この映画は何度も見る____魅力がある。,に堪える,這部電影有值得反覆觀看的魅力。
G026,彼は信頼に足る人物だと多くの人が認めている。,彼は信頼____人物だと多くの人が認めている。,に足る,許多人都認為他是值得信任的人。
G026,この調査結果は判断の根拠とするに足るものだ。,この調査結果は判断の根拠とする____ものだ。,に足る,這項調查結果足以作為判斷依據。
G026,議論に足る証拠がないため、結論は出せない。,議論____証拠がないため、結論は出せない。,に足る,因為沒有足以討論的證據，無法下結論。
G026,彼女の行動は称賛に足る勇気を示している。,彼女の行動は称賛____勇気を示している。,に足る,她的行動展現出值得讚揚的勇氣。
G026,この企画は投資するに足る価値があると判断された。,この企画は投資する____価値があると判断された。,に足る,這項企劃被判斷具有值得投資的價值。
G027,窓の外を見るともなく見ているうちに、雨が雪に変わった。,窓の外を見る____見ているうちに、雨が雪に変わった。,ともなく,無意識地看著窗外時，雨變成了雪。
G027,ラジオを聞くともなく聞いていたら、懐かしい曲が流れてきた。,ラジオを聞く____聞いていたら、懐かしい曲が流れてきた。,ともなく,無意識地聽著廣播時，播出了令人懷念的歌。
G027,彼は誰に話すともなく、昔の思い出を語り始めた。,彼は誰に話す____、昔の思い出を語り始めた。,ともなく,他像不是特別對誰說似地，開始談起往事。
G027,行くともなく駅の方へ歩いていると、友人に会った。,行く____駅の方へ歩いていると、友人に会った。,ともなく,不知不覺往車站方向走時，遇見了朋友。
G027,考えるともなく考えていた問題の答えが、急に浮かんだ。,考える____考えていた問題の答えが、急に浮かんだ。,ともなく,無意識想著的問題答案突然浮現。
G028,彼は家に帰るなり、ソファに倒れ込んだ。,彼は家に帰る____、ソファに倒れ込んだ。,なり,他一回到家就倒在沙發上。
G028,社長は資料を見るなり、表情を険しくした。,社長は資料を見る____、表情を険しくした。,なり,社長一看到資料就表情嚴肅起來。
G028,子どもは母の顔を見るなり、泣き出した。,子どもは母の顔を見る____、泣き出した。,なり,孩子一看到母親的臉就哭了出來。
G028,彼女は電話を切るなり、急いで部屋を出た。,彼女は電話を切る____、急いで部屋を出た。,なり,她一掛電話就急忙離開房間。
G028,犬はドアが開くなり、外へ飛び出した。,犬はドアが開く____、外へ飛び出した。,なり,門一開，狗就衝了出去。
G029,ベルが鳴るが早いか、学生たちは教室を飛び出した。,ベルが鳴る____、学生たちは教室を飛び出した。,が早いか,鈴聲一響，學生們就衝出教室。
G029,店が開くが早いか、客が次々と入ってきた。,店が開く____、客が次々と入ってきた。,が早いか,店一開，客人就接連進來。
G029,彼は質問を聞くが早いか、すぐに答えを言った。,彼は質問を聞く____、すぐに答えを言った。,が早いか,他一聽到問題就立刻說出答案。
G029,雨がやむが早いか、子どもたちは外へ遊びに出た。,雨がやむ____、子どもたちは外へ遊びに出た。,が早いか,雨一停，孩子們就跑到外面玩。
G029,合図が出るが早いか、選手たちは一斉に走り出した。,合図が出る____、選手たちは一斉に走り出した。,が早いか,信號一出，選手們就同時跑了出去。
G030,新しい単語を覚えるそばから、前に覚えたものを忘れてしまう。,新しい単語を覚える____、前に覚えたものを忘れてしまう。,そばから,剛記住新單字，就把之前記的忘掉。
G030,片付けるそばから、子どもがおもちゃを散らかしていく。,片付ける____、子どもがおもちゃを散らかしていく。,そばから,剛收拾好，孩子就把玩具弄亂。
G030,説明するそばから、彼は同じ間違いを繰り返した。,説明する____、彼は同じ間違いを繰り返した。,そばから,剛說明完，他就重複同樣的錯誤。
G030,貯金するそばから、急な出費でお金が出ていく。,貯金する____、急な出費でお金が出ていく。,そばから,剛存錢，就因臨時支出花掉。
G030,注意したそばから、彼はまたスマホを見始めた。,注意した____、彼はまたスマホを見始めた。,そばから,剛提醒完，他又開始看手機。
